Cache Name, Trace File, Total Off-Node Memory Usage, Total Accesses, DRAM Accesses, Overall latency, #NFM nodes, #Backing Store nodes, NFM Utilization, Backing Store Utilization, NFM Hit Rate, Backing Store Hit Rate, NFM hits, Backing Store hits, NFM Misses, Backing Store Misses, Cluster Candidates Created, Candidate Promotion Rate
OCS cache with random conservative replacement for both NFM and backing store,/tmp/db-ubmark-trace/query_equijoin_scale_1_rngseed_0_catalog_sales_ubmark_10000_n2-standard-16.csv,1060864,684033,471054,TODO,24,211,0.294508,0.560068,0.646384,0.787513,130216,301700,71237,81405,61092,0.00039285
OCS cache with random liberal replacement for both NFM and backing store,/tmp/db-ubmark-trace/query_equijoin_scale_1_rngseed_0_catalog_sales_ubmark_10000_n2-standard-16.csv,1314816,818640,471054,TODO,65,191,0.339463,0.398479,0.484573,0.763092,134662,248929,143236,77282,162519,0.000399953
OCS cache with clock replacement for both NFM and backing store,/tmp/db-ubmark-trace/query_equijoin_scale_1_rngseed_0_catalog_sales_ubmark_10000_n2-standard-16.csv,1323008,1020653,471054,TODO,57,209,0.535481,0.358513,0.242873,0.786211,132740,287688,413800,78229,170571,0.000334172
Pure Far-Memory Cache with random replacement,/tmp/db-ubmark-trace/query_equijoin_scale_1_rngseed_0_catalog_sales_ubmark_10000_n2-standard-16.csv,958464,1001976,0,TODO,0,234,0,0.998572,0,0.819993,0,820440,0,180105,0,0
Far Memory cache with clock replacement for both NFM and backing store,/tmp/db-ubmark-trace/query_equijoin_scale_1_rngseed_0_catalog_sales_ubmark_10000_n2-standard-16.csv,958464,1001976,0,TODO,0,234,0,0.998564,0,0.827008,0,827452,0,173085,0,0
